{
  "version": 1,
  "name": "Atmospheric Breakbeat Arc 8 Bars",
  "nodes": [
    {
      "id": "transport-1",
      "type": "transport",
      "position": {
        "x": -180,
        "y": 120
      },
      "data": {
        "type": "transport",
        "bpm": 86,
        "playing": false,
        "beatsPerBar": 4,
        "beatUnit": 4,
        "stepsPerBeat": 2,
        "barsPerPhrase": 8,
        "swing": 0.1,
        "label": "Transport 8 Bars"
      }
    },
    {
      "id": "seq-kick",
      "type": "stepSequencer",
      "position": {
        "x": 70,
        "y": -180
      },
      "data": {
        "type": "stepSequencer",
        "steps": 64,
        "pattern": [
          1,
          0,
          0,
          0,
          0.78,
          0,
          0,
          0,
          0.52,
          0,
          0,
          0,
          0,
          0,
          0,
          0,
          0.82,
          0,
          0,
          0.42,
          0,
          0.6,
          0,
          0.72,
          1,
          0,
          0.74,
          0,
          0.92,
          0,
          0.68,
          0.86,
          0.48,
          0,
          0,
          0,
          0,
          0,
          0,
          0,
          0.76,
          0,
          0,
          0.45,
          0,
          0.58,
          0.64,
          0.72,
          1,
          0,
          0.78,
          0.52,
          0.94,
          0,
          0.72,
          0.88,
          0.66,
          0,
          0,
          0,
          0.42,
          0,
          0,
          0
        ],
        "activeSteps": [
          true,
          false,
          false,
          false,
          true,
          false,
          false,
          false,
          true,
          false,
          false,
          false,
          false,
          false,
          false,
          false,
          true,
          false,
          false,
          true,
          false,
          true,
          false,
          true,
          true,
          false,
          true,
          false,
          true,
          false,
          true,
          true,
          true,
          false,
          false,
          false,
          false,
          false,
          false,
          false,
          true,
          false,
          false,
          true,
          false,
          true,
          true,
          true,
          true,
          false,
          true,
          true,
          true,
          false,
          true,
          true,
          true,
          false,
          false,
          false,
          true,
          false,
          false,
          false
        ],
        "label": "Kick Arc"
      }
    },
    {
      "id": "seq-snare",
      "type": "stepSequencer",
      "position": {
        "x": 70,
        "y": 0
      },
      "data": {
        "type": "stepSequencer",
        "steps": 64,
        "pattern": [
          0,
          0,
          0.72,
          0,
          0,
          0,
          0.78,
          0,
          0,
          0,
          0.48,
          0,
          0,
          0.22,
          0.62,
          0,
          0,
          0,
          0.68,
          0,
          0.22,
          0.34,
          0.74,
          0.42,
          0,
          0,
          0.86,
          0,
          0.18,
          0.42,
          0.92,
          0,
          0,
          0,
          0.5,
          0,
          0,
          0.18,
          0.58,
          0,
          0,
          0,
          0.72,
          0.28,
          0.34,
          0.48,
          0.82,
          0.6,
          0,
          0,
          0.88,
          0,
          0.26,
          0.46,
          1,
          0.18,
          0,
          0,
          0.44,
          0,
          0,
          0,
          0.5,
          0
        ],
        "activeSteps": [
          false,
          false,
          true,
          false,
          false,
          false,
          true,
          false,
          false,
          false,
          true,
          false,
          false,
          true,
          true,
          false,
          false,
          false,
          true,
          false,
          true,
          true,
          true,
          true,
          false,
          false,
          true,
          false,
          true,
          true,
          true,
          false,
          false,
          false,
          true,
          false,
          false,
          true,
          true,
          false,
          false,
          false,
          true,
          true,
          true,
          true,
          true,
          true,
          false,
          false,
          true,
          false,
          true,
          true,
          true,
          true,
          false,
          false,
          true,
          false,
          false,
          false,
          true,
          false
        ],
        "label": "Snare Arc"
      }
    },
    {
      "id": "seq-hat",
      "type": "stepSequencer",
      "position": {
        "x": 70,
        "y": 180
      },
      "data": {
        "type": "stepSequencer",
        "steps": 64,
        "pattern": [
          0.22,
          0,
          0.28,
          0,
          0.24,
          0,
          0.32,
          0,
          0,
          0.18,
          0,
          0.22,
          0,
          0.18,
          0,
          0.26,
          0.28,
          0.16,
          0.34,
          0.18,
          0.32,
          0.22,
          0.42,
          0.2,
          0.4,
          0.22,
          0.46,
          0.24,
          0.42,
          0.26,
          0.5,
          0.28,
          0.18,
          0,
          0.24,
          0,
          0.18,
          0,
          0.28,
          0,
          0.3,
          0.2,
          0.36,
          0.22,
          0.34,
          0.24,
          0.42,
          0.28,
          0.42,
          0.24,
          0.48,
          0.26,
          0.44,
          0.28,
          0.54,
          0.32,
          0.18,
          0,
          0.22,
          0,
          0.18,
          0,
          0.24,
          0
        ],
        "activeSteps": [
          true,
          false,
          true,
          false,
          true,
          false,
          true,
          false,
          false,
          true,
          false,
          true,
          false,
          true,
          false,
          true,
          true,
          true,
          true,
          true,
          true,
          true,
          true,
          true,
          true,
          true,
          true,
          true,
          true,
          true,
          true,
          true,
          true,
          false,
          true,
          false,
          true,
          false,
          true,
          false,
          true,
          true,
          true,
          true,
          true,
          true,
          true,
          true,
          true,
          true,
          true,
          true,
          true,
          true,
          true,
          true,
          true,
          false,
          true,
          false,
          true,
          false,
          true,
          false
        ],
        "label": "Hat Arc"
      }
    },
    {
      "id": "piano-pad",
      "type": "pianoRoll",
      "position": {
        "x": 70,
        "y": 400
      },
      "data": {
        "type": "pianoRoll",
        "steps": 64,
        "octaves": 3,
        "baseNote": 36,
        "notes": [
          {
            "pitch": 50,
            "step": 0,
            "duration": 6,
            "velocity": 0.34
          },
          {
            "pitch": 53,
            "step": 8,
            "duration": 4,
            "velocity": 0.26
          },
          {
            "pitch": 57,
            "step": 12,
            "duration": 3,
            "velocity": 0.22
          },
          {
            "pitch": 50,
            "step": 16,
            "duration": 4,
            "velocity": 0.38
          },
          {
            "pitch": 53,
            "step": 20,
            "duration": 4,
            "velocity": 0.44
          },
          {
            "pitch": 57,
            "step": 24,
            "duration": 4,
            "velocity": 0.54
          },
          {
            "pitch": 60,
            "step": 28,
            "duration": 4,
            "velocity": 0.6
          },
          {
            "pitch": 48,
            "step": 32,
            "duration": 6,
            "velocity": 0.3
          },
          {
            "pitch": 50,
            "step": 40,
            "duration": 2,
            "velocity": 0.38
          },
          {
            "pitch": 53,
            "step": 42,
            "duration": 2,
            "velocity": 0.44
          },
          {
            "pitch": 57,
            "step": 44,
            "duration": 2,
            "velocity": 0.5
          },
          {
            "pitch": 60,
            "step": 46,
            "duration": 2,
            "velocity": 0.56
          },
          {
            "pitch": 50,
            "step": 48,
            "duration": 4,
            "velocity": 0.62
          },
          {
            "pitch": 57,
            "step": 52,
            "duration": 2,
            "velocity": 0.68
          },
          {
            "pitch": 60,
            "step": 54,
            "duration": 2,
            "velocity": 0.72
          },
          {
            "pitch": 50,
            "step": 56,
            "duration": 5,
            "velocity": 0.3
          },
          {
            "pitch": 45,
            "step": 61,
            "duration": 3,
            "velocity": 0.22
          }
        ],
        "label": "Pad Arc"
      }
    },
    {
      "id": "voice-kick",
      "type": "voice",
      "position": {
        "x": 360,
        "y": -180
      },
      "data": {
        "type": "voice",